{
  "$schema": "https://json-schema.org/draft/2020-12/schema",
  "$id": "https://aoa-stats/schemas/stats-event-envelope.schema.json",
  "title": "aoa-stats shared stats event envelope",
  "description": "Canonical cross-repo receipt envelope and event-kind vocabulary for shared aoa-stats derivation inputs. Owner repos keep payload meaning in their own schemas.",
  "x-canonical_owner_repo": "aoa-stats",
  "type": "object",
  "additionalProperties": false,
  "required": [
    "event_kind",
    "event_id",
    "observed_at",
    "run_ref",
    "session_ref",
    "actor_ref",
    "object_ref",
    "evidence_refs",
    "payload"
  ],
  "properties": {
    "event_kind": {
      "type": "string",
      "enum": [
        "actor_responsibility_execution_receipt",
        "automation_candidate_receipt",
        "core_skill_application_receipt",
        "decision_fork_receipt",
        "diagnosis_packet_receipt",
        "eval_result_receipt",
        "harvest_packet_receipt",
        "memo_growth_writeback_receipt",
        "memo_writeback_receipt",
        "playbook_publication_receipt",
        "playbook_review_harvest_receipt",
        "progression_delta_receipt",
        "quest_promotion_receipt",
        "repair_cycle_receipt",
        "reviewed_owner_landing_receipt",
        "runtime_wave_closeout_receipt",
        "seed_owner_landing_trace_receipt",
        "skill_run_receipt",
        "technique_publication_receipt",
        "technique_promotion_receipt",
        "technique_trace_receipt"
      ]
    },
    "event_id": {
      "type": "string",
      "minLength": 1
    },
    "observed_at": {
      "type": "string",
      "format": "date-time"
    },
    "run_ref": {
      "type": "string",
      "minLength": 1
    },
    "session_ref": {
      "type": "string",
      "minLength": 1
    },
    "actor_ref": {
      "type": "string",
      "minLength": 1
    },
    "object_ref": {
      "type": "object",
      "additionalProperties": false,
      "required": [
        "repo",
        "kind",
        "id"
      ],
      "properties": {
        "repo": {
          "type": "string",
          "minLength": 1
        },
        "kind": {
          "type": "string",
          "minLength": 1
        },
        "id": {
          "type": "string",
          "minLength": 1
        },
        "version": {
          "type": "string",
          "minLength": 1
        }
      }
    },
    "evidence_refs": {
      "type": "array",
      "minItems": 1,
      "items": {
        "type": "object",
        "additionalProperties": false,
        "required": [
          "kind",
          "ref"
        ],
        "properties": {
          "kind": {
            "type": "string",
            "minLength": 1
          },
          "ref": {
            "type": "string",
            "minLength": 1
          },
          "role": {
            "type": "string",
            "minLength": 1
          }
        }
      }
    },
    "supersedes": {
      "type": "string",
      "minLength": 1
    },
    "payload": {
      "type": "object"
    }
  }
}
